{
  "$schema": "https://json-schema.org/draft/2020-12/schema",
  "title": "Crabrix signed catalog payload v1",
  "type": "object",
  "required": ["schemaVersion", "sequence", "releaseNotes", "courses"],
  "properties": {
    "schemaVersion": {"const": 1},
    "sequence": {"type": "integer", "minimum": 1},
    "releaseNotes": {"type": "string"},
    "courses": {"type": "array", "items": {"type": "object"}}
  }
}
