{
  "courses": [
    {
      "archiveBytes": 77339425,
      "archiveSHA256": "e43296c4a7cb68d53ff9177e6a74b877d7f73778b840576c45f10efec5db9f70",
      "archiveURL": "https://github.com/sergii-ziborov/crabrix-courses/releases/download/course-updates-2026-10-27.2/algorithms-1.0.6.zip",
      "contentVersion": "1.0.6",
      "courseID": "algorithms",
      "descriptorSHA256": "74c02ed241f706ef2f8101dc771be5ede875c08546c371d7a4bd3e5c52ab17a0",
      "descriptorURL": "https://github.com/sergii-ziborov/crabrix-courses/releases/download/course-updates-2026-10-27.2/algorithms.descriptor.json",
      "language": "en",
      "minimumAppVersion": "1.1",
      "requiredCapabilities": [
        "coursepack-v1",
        "lesson-illustrations-v1"
      ]
    },
    {
      "archiveBytes": 20322556,
      "archiveSHA256": "5a82bd1ebcee8b6b431bba422d60aafeeba7c445ed6f0134dc986f82ccfed261",
      "archiveURL": "https://github.com/sergii-ziborov/crabrix-courses/releases/download/course-updates-2026-10-20/basics-1.0.6.zip",
      "contentVersion": "1.0.6",
      "courseID": "basics",
      "descriptorSHA256": "c274865e5c053e98fe0ed1ff47c4b68fef1334f41fbc46076f4a0d5783ca6f9b",
      "descriptorURL": "https://github.com/sergii-ziborov/crabrix-courses/releases/download/course-updates-2026-10-20/basics.descriptor.json",
      "language": "en",
      "minimumAppVersion": "1.1",
      "requiredCapabilities": [
        "coursepack-v1",
        "lesson-illustrations-v1"
      ]
    },
    {
      "archiveBytes": 12175892,
      "archiveSHA256": "a1f3538f4d6f8471a1fc484598140c45581c80dada26d815e703f1709ce3cd6e",
      "archiveURL": "https://github.com/sergii-ziborov/crabrix-courses/releases/download/course-updates-2026-10-27/concurrency-1.0.5.zip",
      "contentVersion": "1.0.5",
      "courseID": "concurrency",
      "descriptorSHA256": "6b6a388051cbbc4841b12f838699b56c00fa3859d52b3dc339ff51b3113421db",
      "descriptorURL": "https://github.com/sergii-ziborov/crabrix-courses/releases/download/course-updates-2026-10-27/concurrency.descriptor.json",
      "language": "en",
      "minimumAppVersion": "1.1",
      "requiredCapabilities": [
        "coursepack-v1",
        "lesson-illustrations-v1"
      ]
    },
    {
      "archiveBytes": 72387192,
      "archiveSHA256": "89bd11f2fa56a917d246a7bfa1ae3ac0836a91769cc6dfad90d9e12fb78e0a34",
      "archiveURL": "https://github.com/sergii-ziborov/crabrix-courses/releases/download/coursepack-v1.0.10/examples-1.0.4.zip",
      "contentVersion": "1.0.4",
      "courseID": "examples",
      "descriptorSHA256": "963315b499d70fc507a1bdf23fbe83617eaae62e66a5b3ff88edf0934a43fb2d",
      "descriptorURL": "https://github.com/sergii-ziborov/crabrix-courses/releases/download/coursepack-v1.0.10/examples.descriptor.json",
      "language": "en",
      "minimumAppVersion": "1.1",
      "requiredCapabilities": [
        "coursepack-v1",
        "examples-gallery-v1"
      ]
    },
    {
      "archiveBytes": 20703960,
      "archiveSHA256": "637289902e2036e67d717c9631275e2063bb3fe5f713b2da0b978c85c64210b4",
      "archiveURL": "https://github.com/sergii-ziborov/crabrix-courses/releases/download/interview-2026-10-29/interview-1.1.0.zip",
      "contentVersion": "1.1.0",
      "courseID": "interview",
      "descriptorSHA256": "132ebd4fe7dc81bc4d5503bed2081ff12ab28012ebf4d4ed19acce1ba2c7b9ff",
      "descriptorURL": "https://github.com/sergii-ziborov/crabrix-courses/releases/download/interview-2026-10-29/interview.descriptor.json",
      "language": "en",
      "minimumAppVersion": "1.1",
      "requiredCapabilities": [
        "coursepack-v1",
        "lesson-illustrations-v1"
      ]
    },
    {
      "archiveBytes": 22093268,
      "archiveSHA256": "20b55d042f2857e6395415c0140135e1a09a6d401a0c5f25814667a7559b1339",
      "archiveURL": "https://github.com/sergii-ziborov/crabrix-courses/releases/download/course-updates-2026-10-27.2/ownership-1.0.6.zip",
      "contentVersion": "1.0.6",
      "courseID": "ownership",
      "descriptorSHA256": "0af8a23f94618c1c1a8641d30b0ed719b634c545daeb97e648a30d70a1760e19",
      "descriptorURL": "https://github.com/sergii-ziborov/crabrix-courses/releases/download/course-updates-2026-10-27.2/ownership.descriptor.json",
      "language": "en",
      "minimumAppVersion": "1.1",
      "requiredCapabilities": [
        "coursepack-v1",
        "lesson-illustrations-v1"
      ]
    },
    {
      "archiveBytes": 13598637,
      "archiveSHA256": "b4ec1a82bbdd677dc16ea2d3dbbbbb1699b7398d688188318714c0ae5cad7255",
      "archiveURL": "https://github.com/sergii-ziborov/crabrix-courses/releases/download/course-updates-2026-10-27/projects-1.0.6.zip",
      "contentVersion": "1.0.6",
      "courseID": "projects",
      "descriptorSHA256": "daf4ed9e8efe5504d844b2661408c3505510b646421bcfccf12672d244cf7bc6",
      "descriptorURL": "https://github.com/sergii-ziborov/crabrix-courses/releases/download/course-updates-2026-10-27/projects.descriptor.json",
      "language": "en",
      "minimumAppVersion": "1.1",
      "requiredCapabilities": [
        "coursepack-v1",
        "lesson-illustrations-v1"
      ]
    },
    {
      "archiveBytes": 11327804,
      "archiveSHA256": "53833fcbdbc3bceec0fa2e0c0f86fcb66a78e3eef07aaeedf88d59ca94c27362",
      "archiveURL": "https://github.com/sergii-ziborov/crabrix-courses/releases/download/course-updates-2026-10-27/systems-1.0.6.zip",
      "contentVersion": "1.0.6",
      "courseID": "systems",
      "descriptorSHA256": "adcf7eb383404e07b247aaecc2b5dbcdb636f7aaf6461a50f3d6b1c1609e8ced",
      "descriptorURL": "https://github.com/sergii-ziborov/crabrix-courses/releases/download/course-updates-2026-10-27/systems.descriptor.json",
      "language": "en",
      "minimumAppVersion": "1.1",
      "requiredCapabilities": [
        "coursepack-v1",
        "lesson-illustrations-v1"
      ]
    }
  ],
  "releaseNotes": "Interview Prep: 52 focused topics, 12 new Rust contracts, corrected existing questions and distinct oral follow-ups. Existing progress IDs and answer positions preserved.",
  "schemaVersion": 1,
  "sequence": 16
}
